{
  "schema_version": 2,
  "artifact_id": "domainlease-r11-g0-semantic-kernel-contract-v2",
  "language_id": "DL-SemKernel-2",
  "status": "local_draft_external_adoption_required",
  "owner_role": "ROLE-EXTERNAL-SEMANTIC-AUTHORITY",
  "predecessor": {
    "manifest_sha256": "bcdd6c26c5a651f7630df5d218cbd6fb2f20922e2e03cdf109b68b69a7250037",
    "disposition": "rejected_before_external_review",
    "analysis": "0214",
    "validation": "0303"
  },
  "normative_boundary": {
    "canonical_semantics": "the pinned reference interpreter plus this contract and its complete conformance corpus",
    "schema_role": "shape prefilter only",
    "candidate_extension_policy": "closed operator and sort-kind sets; a new operator or kind requires a new externally adopted language epoch",
    "backend_policy": "each backend consumes expanded typed AST and must pass differential conformance before any proof receipt is accepted",
    "prose_policy": "descriptions and notes are non-normative; formulas and structured obligation fields carry normative meaning",
    "authority_policy": "local authors may draft but cannot set external adoption or G0"
  },
  "canonical_encoding": {
    "input": "UTF-8 JSON decoded with duplicate-key rejection",
    "semantic_scalars": ["boolean", "integer", "typed finite atom"],
    "forbidden_scalars": ["null", "floating_point", "untyped_semantic_string"],
    "canonical_output": "ASCII JSON with lexicographically sorted object keys, no insignificant whitespace, and one trailing LF",
    "ast_encoding": "nonempty JSON arrays whose first item is a closed operator id",
    "identity_encoding": "an atom is legal only through typed_lit with a declared finite sort",
    "digest_encoding": "SHA-256 lowercase hexadecimal over exact raw bytes; digest is metadata and never a formula operator"
  },
  "limits": {
    "max_input_bytes": 16777216,
    "max_ast_nodes": 8192,
    "max_ast_depth": 64,
    "max_function_call_depth": 64,
    "max_quantifier_product": 1048576,
    "max_sort_cardinality": 65536,
    "max_state_locations": 1048576,
    "max_operator_arity": 256,
    "limit_authority": "validator-owned and externally pinned; candidate cannot increase a limit"
  },
  "contexts": [
    {
      "id": "STATIC",
      "ast_allowed": true,
      "pre_state": false,
      "post_state": false,
      "action_parameters": false,
      "bounded_quantifiers": true,
      "result_constraint": "declared result sort"
    },
    {
      "id": "STATE",
      "ast_allowed": true,
      "pre_state": true,
      "post_state": false,
      "action_parameters": false,
      "bounded_quantifiers": true,
      "result_constraint": "declared result sort"
    },
    {
      "id": "GUARD",
      "ast_allowed": true,
      "pre_state": true,
      "post_state": false,
      "action_parameters": true,
      "bounded_quantifiers": true,
      "result_constraint": "Bool"
    },
    {
      "id": "TRANSITION",
      "ast_allowed": true,
      "pre_state": true,
      "post_state": true,
      "action_parameters": true,
      "bounded_quantifiers": true,
      "result_constraint": "Bool"
    },
    {
      "id": "INVARIANT",
      "ast_allowed": true,
      "pre_state": true,
      "post_state": false,
      "action_parameters": false,
      "bounded_quantifiers": true,
      "result_constraint": "Bool"
    },
    {
      "id": "RANK",
      "ast_allowed": true,
      "pre_state": true,
      "post_state": false,
      "action_parameters": false,
      "bounded_quantifiers": true,
      "result_constraint": "bounded Nat or lexicographic tuple of bounded Nat"
    },
    {
      "id": "OBSERVATION",
      "ast_allowed": true,
      "pre_state": true,
      "post_state": false,
      "action_parameters": false,
      "bounded_quantifiers": true,
      "result_constraint": "declared finite observation sort",
      "notes": "state products are restricted by an external observation projection"
    },
    {
      "id": "TEMPORAL",
      "ast_allowed": false,
      "pre_state": false,
      "post_state": false,
      "action_parameters": false,
      "bounded_quantifiers": false,
      "result_constraint": "structured obligation record only",
      "notes": "general free-form temporal AST is forbidden"
    }
  ],
  "sort_kinds": [
    {
      "id": "BOOL",
      "finite": true,
      "semantic_rule": "exact values false and true",
      "required_fields": [],
      "forbidden_fields": ["unit", "maximum", "values"]
    },
    {
      "id": "BOUNDED_NAT",
      "finite": true,
      "semantic_rule": "integers from zero through a validator-pinned maximum with one declared unit",
      "required_fields": ["unit", "maximum"],
      "forbidden_fields": ["values"]
    },
    {
      "id": "FINITE_ENUM",
      "finite": true,
      "semantic_rule": "closed nonempty set of distinct typed atoms",
      "required_fields": ["values"],
      "forbidden_fields": ["unit", "maximum"]
    },
    {
      "id": "FINITE_IDENTITY",
      "finite": true,
      "semantic_rule": "closed nonempty atom set with mandatory namespace and generation component policy",
      "required_fields": ["values", "namespace_kind", "generation_sort"],
      "forbidden_fields": ["unit", "maximum"]
    },
    {
      "id": "OPTION",
      "finite": true,
      "semantic_rule": "disjoint None or Some(element); elimination is total only through option_match",
      "required_fields": ["element_sort"],
      "forbidden_fields": ["unit", "maximum", "values"]
    },
    {
      "id": "RECORD",
      "finite": true,
      "semantic_rule": "named product with a closed nonempty ordered field signature",
      "required_fields": ["fields"],
      "forbidden_fields": ["unit", "maximum", "values"]
    },
    {
      "id": "VARIANT",
      "finite": true,
      "semantic_rule": "disjoint tagged sum with closed tags; field access occurs only in variant_match branch scope",
      "required_fields": ["variants"],
      "forbidden_fields": ["unit", "maximum", "values"]
    },
    {
      "id": "TUPLE",
      "finite": true,
      "semantic_rule": "fixed ordered product of declared member sorts",
      "required_fields": ["member_sorts"],
      "forbidden_fields": ["unit", "maximum", "values"]
    },
    {
      "id": "FINITE_SET",
      "finite": true,
      "semantic_rule": "canonical duplicate-free subset of a declared finite element sort",
      "required_fields": ["element_sort"],
      "forbidden_fields": ["unit", "maximum", "values"]
    },
    {
      "id": "RESOURCE_VECTOR",
      "finite": true,
      "semantic_rule": "closed record of named bounded-Nat components preserving each component unit",
      "required_fields": ["components"],
      "forbidden_fields": ["unit", "maximum", "values"]
    }
  ],
  "operators": [
    {"id":"bool_lit","arity":{"minimum":1,"maximum":1},"allowed_contexts":["STATIC","STATE","GUARD","TRANSITION","INVARIANT","RANK","OBSERVATION"],"operand_rule":"BOOLEAN-SCALAR","result_rule":"BOOL","evaluation_rule":"BOOLEAN-LITERAL","total":true},
    {"id":"typed_lit","arity":{"minimum":2,"maximum":2},"allowed_contexts":["STATIC","STATE","GUARD","TRANSITION","INVARIANT","RANK","OBSERVATION"],"operand_rule":"DECLARED-SORT-AND-MEMBER","result_rule":"NAMED-SORT","evaluation_rule":"TYPED-LITERAL","total":true},
    {"id":"param","arity":{"minimum":1,"maximum":1},"allowed_contexts":["STATIC","STATE","GUARD","TRANSITION","INVARIANT","RANK","OBSERVATION"],"operand_rule":"BOUND-PARAMETER-ID","result_rule":"PARAMETER-SORT","evaluation_rule":"ENVIRONMENT-LOOKUP","total":true},
    {"id":"const","arity":{"minimum":1,"maximum":1},"allowed_contexts":["STATIC","STATE","GUARD","TRANSITION","INVARIANT","RANK","OBSERVATION"],"operand_rule":"DECLARED-CONSTANT-ID","result_rule":"CONSTANT-SORT","evaluation_rule":"CONSTANT-LOOKUP","total":true},
    {"id":"pre","arity":{"minimum":1,"maximum":257},"allowed_contexts":["STATE","GUARD","TRANSITION","INVARIANT","RANK","OBSERVATION"],"operand_rule":"STATE-PRODUCT-AND-TYPED-KEYS","result_rule":"STATE-PRODUCT-VALUE-SORT","evaluation_rule":"PRE-STATE-LOOKUP","total":true},
    {"id":"post","arity":{"minimum":1,"maximum":257},"allowed_contexts":["TRANSITION"],"operand_rule":"STATE-PRODUCT-AND-TYPED-KEYS","result_rule":"STATE-PRODUCT-VALUE-SORT","evaluation_rule":"POST-STATE-LOOKUP","total":true},
    {"id":"call","arity":{"minimum":1,"maximum":257},"allowed_contexts":["STATIC","STATE","GUARD","TRANSITION","INVARIANT","RANK","OBSERVATION"],"operand_rule":"PURE-FUNCTION-AND-TYPED-ARGUMENTS","result_rule":"FUNCTION-RESULT-SORT","evaluation_rule":"ACYCLIC-CALL-BY-VALUE","total":true},
    {"id":"record","arity":{"minimum":2,"maximum":2},"allowed_contexts":["STATIC","STATE","GUARD","TRANSITION","INVARIANT","RANK","OBSERVATION"],"operand_rule":"RECORD-SORT-AND-EXACT-FIELD-AST-MAP","result_rule":"NAMED-RECORD-SORT","evaluation_rule":"RECORD-CONSTRUCTION","total":true},
    {"id":"field","arity":{"minimum":2,"maximum":2},"allowed_contexts":["STATIC","STATE","GUARD","TRANSITION","INVARIANT","RANK","OBSERVATION"],"operand_rule":"RECORD-EXPRESSION-AND-DECLARED-FIELD","result_rule":"FIELD-SORT","evaluation_rule":"RECORD-PROJECTION","total":true},
    {"id":"variant","arity":{"minimum":3,"maximum":3},"allowed_contexts":["STATIC","STATE","GUARD","TRANSITION","INVARIANT","RANK","OBSERVATION"],"operand_rule":"VARIANT-SORT-TAG-AND-EXACT-FIELD-AST-MAP","result_rule":"NAMED-VARIANT-SORT","evaluation_rule":"VARIANT-CONSTRUCTION","total":true},
    {"id":"variant_match","arity":{"minimum":3,"maximum":3},"allowed_contexts":["STATIC","STATE","GUARD","TRANSITION","INVARIANT","RANK","OBSERVATION"],"operand_rule":"VARIANT-EXPRESSION-EXACT-BRANCH-MAP-AND-CLOSED-RESULT-SORT","result_rule":"COMMON-BRANCH-SORT","evaluation_rule":"TOTAL-TAGGED-BRANCH","total":true},